{
  "schema_version": "identity-prime.tokenization-profile.v1",
  "profile_id": "tp_patient_mrn_chameleon",
  "field_selector": {
    "path": "$.patient.mrn",
    "data_class": "direct_identifier"
  },
  "scheme": "chameleon_token",
  "reversibility": "reversible",
  "domain_scope": "INSTITUTION",
  "cross_domain_linkable": false,
  "preserve": {
    "length": false,
    "format": true,
    "semantic": false,
    "checksum": false
  },
  "key": {
    "key_ref": "kmip:institution/mrn-tokenization",
    "key_epoch": 3,
    "update_tweak_ref": "tweak:institution/mrn/epoch-2-to-3"
  },
  "hsm": {
    "backed": true,
    "fips_level": "FIPS_140-2_L3"
  },
  "reidentification_class": "exportable_to_legal_counsel",
  "policy_tags": ["health", "regulated_identifier"],
  "scheme_version": "chameleon.reference@0.1.0",
  "created_at": "2026-06-29T15:00:00Z"
}
